id,relid,year,active_year,code_status,type_of_violence,conflict_dset_id,conflict_new_id,conflict_name,dyad_dset_id,dyad_new_id,dyad_name,side_a_dset_id,side_a_new_id,side_a,side_b_dset_id,side_b_new_id,side_b,number_of_sources,source_article,source_office,source_date,source_headline,source_original,where_prec,where_coordinates,where_description,adm_1,adm_2,latitude,longitude,geom_wkt,priogrid_gid,country,country_id,region,event_clarity,date_prec,date_start,date_end,deaths_a,deaths_b,deaths_civilians,deaths_unknown,best,high,low,gwnoa,gwnob,interaction
490469,BEN-2023-1-16685-12,2023,True,Clear,1,15256,15256,Benin: Government,16685,16685,Government of Benin - JNIM,1209,1209,Government of Benin,6716,6716,JNIM,2,"""Banouto,2023-08-25,Bénin : 02 présumés terroristes neutralisés à Karimama"";""Fraternite FM 96.5,2023-08-25,Quatre Individus Armés Non Identifiés neutralisés""",Banouto;Fraternite FM 96.5,2023-08-25;2023-08-25,Bénin : 02 présumés terroristes neutralisés à Karimama;Quatre Individus Armés Non Identifiés neutralisés,military sources,3,Karimama commune,"Sikawatédji, in the commune of Karimama",Alibori department,Karimama commune,11.93816,2.75703,POINT (2.75703 11.93816),146526,Benin,434,Africa,1,2,08/22/2023 00:00:00,08/23/2023 00:00:00,0,2,0,0,2,2,2,434.0,-,41
494293,BEN-2023-3-15136-113.1,2023,True,Clear,3,6716,13968,JNIM - Civilians,6716,15136,JNIM - Civilians,6716,6716,JNIM,9999,1,Civilians,1,"""International Crisis Group,2023-10-02,Crisis Watch: Benin SEPTEMBER 2023""",International Crisis Group,2023-10-02,Crisis Watch: Benin SEPTEMBER 2023,-,3,Karimama commune,Alibori department’s Karimama commune,Alibori department,Karimama commune,11.93816,2.75703,POINT (2.75703 11.93816),146526,Benin,434,Africa,1,1,09/06/2023 00:00:00,09/06/2023 00:00:00,0,0,3,0,3,3,3,-,-,15
494294,BEN-2023-1-16685-14,2023,True,Clear,1,15256,15256,Benin: Government,16685,16685,Government of Benin - JNIM,1209,1209,Government of Benin,6716,6716,JNIM,1,"""International Crisis Group,2023-10-02,Crisis Watch: Benin SEPTEMBER 2023""",International Crisis Group,2023-10-02,Crisis Watch: Benin SEPTEMBER 2023,-,5,Pendjari National Park,"Atakora department, Materi commune near Pendjari National Park",Atacora department,-,11.04999,1.51667,POINT (1.51667 11.04999),145804,Benin,434,Africa,1,1,09/15/2023 00:00:00,09/15/2023 00:00:00,2,0,0,0,2,2,2,434.0,-,41
501583,BEN-2023-1-16685-17,2023,True,Clear,1,15256,15256,Benin: Government,16685,16685,Government of Benin - JNIM,1209,1209,Government of Benin,6716,6716,JNIM,2,"""BBC Monitoring Africa,2023-11-10,Benin steps up operations against militants - report"";""International Crisis Group,2023-12-01,Benin November 2023""",BBC Monitoring Africa;International Crisis Group,2023-11-10;2023-12-01,Benin steps up operations against militants - report;Benin November 2023,the army,2,Porga town,near Porga,Atacora department,Matéri commune,11.05,0.966667,POINT (0.966667 11.05),145802,Benin,434,Africa,1,1,11/09/2023 00:00:00,11/09/2023 00:00:00,0,1,0,0,1,1,1,434.0,-,41
503705,BEN-2023-3-15136-151,2023,True,Clear,3,6716,13968,JNIM - Civilians,6716,15136,JNIM - Civilians,6716,6716,JNIM,9999,1,Civilians,1,"""Banouto,2023-01-31,Banikoara: Chief of Guimbagou village killed in attack on school""",Banouto,2023-01-31,Banikoara: Chief of Guimbagou village killed in attack on school,security sources,3,Banikoara commune,"Yinyinrou, a locality in the village of Guimbagou, Toura district in Banikoara commune.",Alibori department,Banikoara commune,11.33966,2.45915,POINT (2.45915 11.33966),145805,Benin,434,Africa,1,2,01/30/2023 00:00:00,01/31/2023 00:00:00,0,0,3,0,3,3,3,-,-,15
506723,BEN-2023-1-16685-19,2023,True,Clear,1,15256,15256,Benin: Government,16685,16685,Government of Benin - JNIM,1209,1209,Government of Benin,6716,6716,JNIM,3,"""24 Hours in Benin,2023-12-12,Two soldiers killed in Karimama"";""Agence France Presse,2023-12-13,Benin landmine blast kills two soldiers: security sources"";""International Crisis Group,2024-01-01,Benin DECEMBER 2023""",24 Hours in Benin;Agence France Presse;International Crisis Group,2023-12-12;2023-12-13;2024-01-01,Two soldiers killed in Karimama;Benin landmine blast kills two soldiers: security sources;Benin DECEMBER 2023,-,3,Karimama commune,"in Karimama commune, Alibori department",Alibori department,Karimama commune,11.93816,2.75703,POINT (2.75703 11.93816),146526,Benin,434,Africa,2,1,12/12/2023 00:00:00,12/12/2023 00:00:00,2,0,0,0,2,2,2,434.0,-,41
511635,BEN-2023-1-16685-21,2023,True,Clear,1,15256,15256,Benin: Government,16685,16685,Government of Benin - JNIM,1209,1209,Government of Benin,6716,6716,JNIM,1,"""Africa Research Bulletin,2024-02-13,Political, Social and Cultural Series Volume 61, Issue 1""",Africa Research Bulletin,2024-02-13,"Political, Social and Cultural Series Volume 61, Issue 1",-,5,Pendjari National Park,Pendjari National Park,Atacora department,-,11.04999,1.51667,POINT (1.51667 11.04999),145804,Benin,434,Africa,1,4,10/01/2023 00:00:00,10/31/2023 00:00:00,0,0,0,0,0,2,0,434.0,-,41
