id,relid,year,active_year,code_status,type_of_violence,conflict_dset_id,conflict_new_id,conflict_name,dyad_dset_id,dyad_new_id,dyad_name,side_a_dset_id,side_a_new_id,side_a,side_b_dset_id,side_b_new_id,side_b,number_of_sources,source_article,source_office,source_date,source_headline,source_original,where_prec,where_coordinates,where_description,adm_1,adm_2,latitude,longitude,geom_wkt,priogrid_gid,country,country_id,region,event_clarity,date_prec,date_start,date_end,deaths_a,deaths_b,deaths_civilians,deaths_unknown,best,high,low,gwnoa,gwnob,interaction
237734,TUN-2017-1-10882-3,2017,False,Clear,1,343,343,Tunisia: Government,10882,10882,Government of Tunisia - AQIM,110,110,Government of Tunisia,539,539,AQIM,8,"""Reuters News,2017-04-30,Tunisia police clash with militants in central city - official"";""Agence France Presse,2017-04-30,Tunisia says 2 jihadists killed"";""Reuters News,2017-04-30,Tunisia forces kill senior militant commander planning Ramadan attack"";""Agence France Presse,2017-04-30,Tunisia says 2 jihadists killed in security sweep"";""Reuters News,2017-04-30,UPDATE 2-Tunisia forces kill senior militant commander planning Ramadan attack"";""All Africa,2017-05-01,Tunisia Forces Kill Fighters Planning Ramadan Attack"";""ICG,2017-04-30,Tunisia  APRIL 2017"";""Menastream,2018-08-17,In Tunisia TUNISIA: JOINT OPERATION BETWEEN TUNISIAN AND U.S. FORCES TARGETED AQIM MILITANTS IN KASSERINE – “BATTLE OF MOUNT SEMMAMA”""",Reuters News;Agence France Presse;Reuters News;Agence France Presse;Reuters News;All Africa;ICG;Menastream,2017-04-30;2017-04-30;2017-04-30;2017-04-30;2017-04-30;2017-05-01;2017-04-30;2018-08-17,Tunisia police clash with militants in central city - official;Tunisia says 2 jihadists killed;Tunisia forces kill senior militant commander planning Ramadan attack;Tunisia says 2 jihadists killed in security sweep;UPDATE 2-Tunisia forces kill senior militant commander planning Ramadan attack;Tunisia Forces Kill Fighters Planning Ramadan Attack;Tunisia  APRIL 2017;In Tunisia TUNISIA: JOINT OPERATION BETWEEN TUNISIAN AND U.S. FORCES TARGETED AQIM MILITANTS IN KASSERINE – “BATTLE OF MOUNT SEMMAMA”,spokesman Khalifa Chibani,1,Sidi Bouzid town,Sidi Bouzid,Sidi Bou Zid governorate,Sidi Bouzid Est delegation,35.038234,9.484935,POINT (9.484935 35.038234),180379,Tunisia,616,Africa,1,1,04/30/2017 00:00:00,04/30/2017 00:00:00,0,2,0,0,2,2,2,616.0,-,41
238019,TUN-2017-1-10882-4,2017,False,Clear,1,343,343,Tunisia: Government,10882,10882,Government of Tunisia - AQIM,110,110,Government of Tunisia,539,539,AQIM,3,"""Agence France Presse,2017-05-29,Tunisia security forces kill IS fugitive"";""Agence France Presse,2017-06-03,Beheaded Tunisian shepherd's brother killed: reports"";""Crisis Watch,2017-05-31,Tunisia MAY 2017""",Agence France Presse;Agence France Presse;Crisis Watch,2017-05-29;2017-06-03;2017-05-31,Tunisia security forces kill IS fugitive;Beheaded Tunisian shepherd's brother killed: reports;Tunisia MAY 2017,The interior ministry,4,Kassérine governorate,near the Algerian border.,Kassérine governorate,-,35.25,8.783333,POINT (8.783333 35.25),180378,Tunisia,616,Africa,1,1,05/29/2017 00:00:00,05/29/2017 00:00:00,0,1,0,0,1,1,1,616.0,-,41
238838,TUN-2017-1-10882-6,2017,False,Clear,1,343,343,Tunisia: Government,10882,10882,Government of Tunisia - AQIM,110,110,Government of Tunisia,539,539,AQIM,1,"""Agence France Presse,2017-06-12,Tunisian soldier dead after landmine blast""",Agence France Presse,2017-06-12,Tunisian soldier dead after landmine blast,the defence ministry,5,Mount Ouergha,on Mount Ouergha in the west of the country near the Algerian border,Le Kef governorate,-,36.205,8.491,POINT (8.491 36.205),181817,Tunisia,616,Africa,1,1,06/09/2017 00:00:00,06/09/2017 00:00:00,1,0,0,0,1,1,1,616.0,-,41
238846,TUN-2017-1-14744-1,2017,False,Clear,1,343,343,Tunisia: Government,14744,14744,Government of Tunisia - JAK-T,110,110,Government of Tunisia,6359,6359,JAK-T,1,"""Agence France Presse,2017-06-16,Tunisia landmine blasts kills shepherdess""",Agence France Presse,2017-06-16,Tunisia landmine blasts kills shepherdess,a security official,2,Jebel Selloum,about one kilometre (mile) into the Mount Salloum military zone,Kassérine governorate,Kasserine Sud delegation,35.07485,8.90575,POINT (8.90575 35.07485),180378,Tunisia,616,Africa,1,1,06/16/2017 00:00:00,06/16/2017 00:00:00,0,0,0,0,0,1,0,616.0,-,41
240355,TUN-2017-1-10882-5,2017,False,Clear,1,343,343,Tunisia: Government,10882,10882,Government of Tunisia - AQIM,110,110,Government of Tunisia,539,539,AQIM,3,"""Reuters News,2017-08-09,Tunisian security forces kill senior militant in ambush: sources"";""Agence France Presse,2017-08-09,Tunisian security forces kill two suspected jihadists"";""Africa Research Bulletin Volume 54 Issue 8,2017-09-14,In Brief Tunisa""",Reuters News;Agence France Presse;Africa Research Bulletin Volume 54 Issue 8,2017-08-09;2017-08-09;2017-09-14,Tunisian security forces kill senior militant in ambush: sources;Tunisian security forces kill two suspected jihadists;In Brief Tunisa,security sources,2,Jebel Bireno,Mount Birinou in the Kasserine region,Kassérine governorate,Thala delegation,35.450553,8.618879,POINT (8.618879 35.450553),180378,Tunisia,616,Africa,1,1,08/08/2017 00:00:00,08/08/2017 00:00:00,0,3,0,0,3,3,3,616.0,-,41
249780,TUN-2017-1-10882-0,2017,False,Clear,1,343,343,Tunisia: Government,10882,10882,Government of Tunisia - AQIM,110,110,Government of Tunisia,539,539,AQIM,3,"""BBC Monitoring Middle East,2017-12-13,Al-Qaeda-linked Tunisian group claims attack on army"";""ICG,2018-01-01,Crisiswatch - December 2017 - Tunisia"";""Africa Research Bulletin,2018-02-01,PoliticalSocial andCultural SeriesVolume 54 Number 12 December 1st–31st 2017""",BBC Monitoring Middle East;ICG;Africa Research Bulletin,2017-12-13;2018-01-01;2018-02-01,Al-Qaeda-linked Tunisian group claims attack on army;Crisiswatch - December 2017 - Tunisia;PoliticalSocial andCultural SeriesVolume 54 Number 12 December 1st–31st 2017,Ministry of Defence,2,Jebel Chaambi,"Chaambi Mountains, Kasserine region",Kassérine governorate,-,35.183333,8.65,POINT (8.65 35.183333),180378,Tunisia,616,Africa,1,1,12/11/2017 00:00:00,12/11/2017 00:00:00,1,0,0,0,1,1,1,616.0,-,41
254809,TUN-2018-1-14744-0,2018,False,Clear,1,343,343,Tunisia: Government,14744,14744,Government of Tunisia - JAK-T,110,110,Government of Tunisia,6359,6359,JAK-T,6,"""Agence France Presse,2018-03-19,Tunisian man chased by police 'blows self up': ministry"";""Agence France Presse,2018-03-19,Tunisian man chased by police 'blows self up': ministry"";""Agence France Presse,2018-03-19,Tunisian man chased by police 'blows himself up': ministry"";""Associated Press Newswires,2018-03-19,Tunisia: Officials say man blew himself up after standoff"";""International Crisis Group,2018-04-01,Crisiswatch: Tunisia - March 2018"";""BBC Monitoring Middle East,2018-04-06,IS says suicide bomber in Tunisia was member of group""",Agence France Presse;Agence France Presse;Agence France Presse;Associated Press Newswires;International Crisis Group;BBC Monitoring Middle East,2018-03-19;2018-03-19;2018-03-19;2018-03-19;2018-04-01;2018-04-06,Tunisian man chased by police 'blows self up': ministry;Tunisian man chased by police 'blows self up': ministry;Tunisian man chased by police 'blows himself up': ministry;Tunisia: Officials say man blew himself up after standoff;Crisiswatch: Tunisia - March 2018;IS says suicide bomber in Tunisia was member of group,Interior ministry spokesman Khalifa Chibani; weekly Arabic newsletter al-Naba,3,Ben Guerdane delegation,"in the southern region of Ben Guerdane,

in the Magroun region",Medenine governorate,Ben Guerdane delegation,32.950209,11.277112,POINT (11.277112 32.950209),176783,Tunisia,616,Africa,1,1,03/19/2018 00:00:00,03/19/2018 00:00:00,0,2,0,0,2,2,2,616.0,-,41
254894,TUN-2018-1-14744-1,2018,False,Clear,1,343,343,Tunisia: Government,14744,14744,Government of Tunisia - JAK-T,110,110,Government of Tunisia,6359,6359,JAK-T,2,"""International Crisis Group,2018-04-01,Crisiswatch: Tunisia - March 2018"";""Menastream,2018-04-01,#Tunisia: #USGN killed an #ISIS/Jund al-Khilafah militant around 22h last night in Douar Rogba near Jebel Salloum, Hassi Frid delegation, #Kasserine, a Steyr AUG rifle, 5 magazines, ammunition & cash were also seized, other militants were reportedly wounded amidst the operation""",International Crisis Group;Menastream,2018-04-01;2018-04-01,"Crisiswatch: Tunisia - March 2018;#Tunisia: #USGN killed an #ISIS/Jund al-Khilafah militant around 22h last night in Douar Rogba near Jebel Salloum, Hassi Frid delegation, #Kasserine, a Steyr AUG rifle, 5 magazines, ammunition & cash were also seized, other militants were reportedly wounded amidst the operation",Crisiswatch; Menastream twitter,3,Hassi El Ferid delegation,"in Kasserine province

Douar Rogba near Jebel Salloum, Hassi Frid delegation,",Kassérine governorate,Hassi El Ferid delegation,34.961269,8.918961,POINT (8.918961 34.961269),179658,Tunisia,616,Africa,1,1,03/31/2018 00:00:00,03/31/2018 00:00:00,0,1,0,0,1,1,1,616.0,-,41
255530,TUN-2018-1-14744-2,2018,False,Clear,1,343,343,Tunisia: Government,14744,14744,Government of Tunisia - JAK-T,110,110,Government of Tunisia,6359,6359,JAK-T,2,"""BBC Monitoring Middle East,2018-04-11,Islamic State claims activity in Tunisia after lull"";""BBC Monitoring Middle East,2018-04-11,Tunisian officer dies of wounds after clashes with 'terrorists'""",BBC Monitoring Middle East;BBC Monitoring Middle East,2018-04-11;2018-04-11,Islamic State claims activity in Tunisia after lull;Tunisian officer dies of wounds after clashes with 'terrorists',a source from the ministry of defence;  IS's self-styled news agency Amaq,2,Jebel Mghila,Djebel Mghila,Sidi Bou Zid governorate,-,35.4013,9.2063,POINT (9.2063 35.4013),180379,Tunisia,616,Africa,1,1,04/10/2018 00:00:00,04/10/2018 00:00:00,1,0,0,0,1,1,1,616.0,-,41
256730,TUN-2018-1-14744-3,2018,False,Clear,1,343,343,Tunisia: Government,14744,14744,Government of Tunisia - JAK-T,110,110,Government of Tunisia,6359,6359,JAK-T,1,"""BBC Monitoring Middle East,2018-05-22,Tunisian army kills militant in clash in mountain hideout""",BBC Monitoring Middle East,2018-05-22,Tunisian army kills militant in clash in mountain hideout,Tunisian Ministry of Defence,2,Jebel Selloum,Mount Salloum area in Kasserine govenorate,Kassérine governorate,Kasserine Sud delegation,35.07485,8.90575,POINT (8.90575 35.07485),180378,Tunisia,616,Africa,1,1,05/21/2018 00:00:00,05/21/2018 00:00:00,0,1,0,0,1,1,1,616.0,-,41
256919,TUN-2018-1-10882-5,2018,False,Clear,1,343,343,Tunisia: Government,10882,10882,Government of Tunisia - AQIM,110,110,Government of Tunisia,539,539,AQIM,1,"""Menastream,2018-05-05,#Tunisia: #USGN ambushed a group of #KUBN militants on the night between Wednesday and Thursday in the area of Ouled Boughanem at Jebel Ajered (Foussana), #Kasserine, one militant killed and AK seized (MOI)""",Menastream,2018-05-05,"#Tunisia: #USGN ambushed a group of #KUBN militants on the night between Wednesday and Thursday in the area of Ouled Boughanem at Jebel Ajered (Foussana), #Kasserine, one militant killed and AK seized (MOI)",Menastream twitter,2,Ouled Boughanem town,"area of Ouled Boughanem at Jebel Ajered (Foussana)
Kasserine",Kassérine governorate,Foussana delegation,35.3265,8.53156,POINT (8.53156 35.3265),180378,Tunisia,616,Africa,1,2,05/02/2018 00:00:00,05/03/2018 00:00:00,0,1,0,0,1,1,1,616.0,-,41
258313,ALG-2018-3-1040-1,2018,False,Clear,3,539,573,AQIM - Civilians,539,1040,AQIM - Civilians,539,539,AQIM,9999,1,Civilians,3,"""Agence France Presse,2018-06-25,Tunisia shepherd dies after jihadist attack: ministry"";""BBC Monitoring Middle East,2018-06-27,Al-Qaeda-linked group denies killing Tunisian shepherd"";""Critical Threats,2018-10-07,2018 07-10 CTP Update and Assessment""",Agence France Presse;BBC Monitoring Middle East;Critical Threats,2018-06-25;2018-06-27;2018-10-07,Tunisia shepherd dies after jihadist attack: ministry;Al-Qaeda-linked group denies killing Tunisian shepherd;2018 07-10 CTP Update and Assessment,Defence ministry;  Uqbah bin Nafi Brigade on Telegram,2,Jebel Chaambi,"Mount Chaambi, in Kasserine,",Kassérine governorate,-,35.183333,8.65,POINT (8.65 35.183333),180378,Tunisia,616,Africa,1,1,06/23/2018 00:00:00,06/23/2018 00:00:00,0,0,1,0,1,1,0,-,-,15
260459,TUN-2018-1-10882-2,2018,False,Clear,1,343,343,Tunisia: Government,10882,10882,Government of Tunisia - AQIM,110,110,Government of Tunisia,539,539,AQIM,6,"""Agence France Presse,2018-07-08,'Terrorist attack' kills 8 Tunisia security forces: ministry"";""Agence France Presse,2018-07-08,'Terrorist attack' kills 6 Tunisia security forces: ministry"";""Agence France Presse,2018-07-08,'Terrorist attack' kills 6 Tunisia security forces"";""BBC Monitoring Middle East,2018-07-09,Tunisia interior minister vows to pursue those behind attack"";""Jamestown Foundation,2018-08-10,Briefs Publication: Terrorism Monitor Volume: 16 Issue: 16 By: Alexander Sehmer"";""Critical Threats,2018-10-07,2018 07-10 CTP Update and Assessment""",Agence France Presse;Agence France Presse;Agence France Presse;BBC Monitoring Middle East;Jamestown Foundation;Critical Threats,2018-07-08;2018-07-08;2018-07-08;2018-07-09;2018-08-10;2018-10-07,'Terrorist attack' kills 8 Tunisia security forces: ministry;'Terrorist attack' kills 6 Tunisia security forces: ministry;'Terrorist attack' kills 6 Tunisia security forces;Tunisia interior minister vows to pursue those behind attack;Briefs Publication: Terrorism Monitor Volume: 16 Issue: 16 By: Alexander Sehmer;2018 07-10 CTP Update and Assessment,"General Sufyan al-Zaq, Interior Ministry",2,Ain Soltane municipality,Ain Sultan area of Jenduba border province,Jendouba governorate,Ghardimaou delegation,36.52721,8.34375,POINT (8.34375 36.52721),182537,Tunisia,616,Africa,1,1,07/08/2018 00:00:00,07/08/2018 00:00:00,9,0,0,0,9,9,8,616.0,-,41
263020,TUN-2018-1-10882-3,2018,False,Clear,1,343,343,Tunisia: Government,10882,10882,Government of Tunisia - AQIM,110,110,Government of Tunisia,539,539,AQIM,8,"""Reuters News,2018-01-20,Tunisian forces kill top aide of Al Qaeda leader in Maghreb: official"";""Agence France Presse,2018-01-21,Tunisia kills senior Al-Qaeda member"";""Reuters News,2018-01-21,Tunisia forces kill the new leader of local branch of al-Qaeda"";""Associated Press Newswires,2018-01-21,Tunisian security forces kill 2 Algerian Islamic extremists"";""BBC Monitoring Middle East,2018-01-21,Tunisian security kill Algerian al-Qaeda figure"";""BBC Monitoring Middle East,2018-01-25,Tunisia steps up counterterrorism efforts"";""Africa Research Bulletin,2018-03-01,Political, Social and Cultural Series: Vol. 55 No. 1"";""Menastream,2018-08-17,In Tunisia TUNISIA: JOINT OPERATION BETWEEN TUNISIAN AND U.S. FORCES TARGETED AQIM MILITANTS IN KASSERINE – “BATTLE OF MOUNT SEMMAMA”""",Reuters News;Agence France Presse;Reuters News;Associated Press Newswires;BBC Monitoring Middle East;BBC Monitoring Middle East;Africa Research Bulletin;Menastream,2018-01-20;2018-01-21;2018-01-21;2018-01-21;2018-01-21;2018-01-25;2018-03-01;2018-08-17,"Tunisian forces kill top aide of Al Qaeda leader in Maghreb: official;Tunisia kills senior Al-Qaeda member;Tunisia forces kill the new leader of local branch of al-Qaeda;Tunisian security forces kill 2 Algerian Islamic extremists;Tunisian security kill Algerian al-Qaeda figure;Tunisia steps up counterterrorism efforts;Political, Social and Cultural Series: Vol. 55 No. 1;In Tunisia TUNISIA: JOINT OPERATION BETWEEN TUNISIAN AND U.S. FORCES TARGETED AQIM MILITANTS IN KASSERINE – “BATTLE OF MOUNT SEMMAMA”",an official,2,Jebel Semmama,"near the Algerian border 

in the Mount Sammama area of central-western Tunisia

on the western hillside of Mount Semmama near the town of Khmouda",Kassérine governorate,-,35.31804,8.8523,POINT (8.8523 35.31804),180378,Tunisia,616,Africa,1,1,01/20/2018 00:00:00,01/20/2018 00:00:00,0,2,0,0,2,2,2,616.0,-,41
265983,TUN-2018-1-10882-7,2018,False,Clear,1,343,343,Tunisia: Government,10882,10882,Government of Tunisia - AQIM,110,110,Government of Tunisia,539,539,AQIM,1,"""Agence France Presse,2018-09-25,Two killed in land mine blast in Tunisia Islamist hideout""",Agence France Presse,2018-09-25,Two killed in land mine blast in Tunisia Islamist hideout,defence ministry,2,Jebel Chaambi,"Mount Chaambi,",Kassérine governorate,-,35.183333,8.65,POINT (8.65 35.183333),180378,Tunisia,616,Africa,1,1,09/24/2018 00:00:00,09/24/2018 00:00:00,0,0,0,2,2,2,2,616.0,-,41
269050,TUN-2018-1-10882-1,2018,False,Clear,1,343,343,Tunisia: Government,10882,10882,Government of Tunisia - AQIM,110,110,Government of Tunisia,539,539,AQIM,2,"""Xinhua French News Service,2018-10-04,Tunisie : les conflits politiques alimentent les défaillances sécuritaires (ministre de la Défense)"";""Xinhua French News Service,2018-10-03,Tunisie : au centre-ouest, un soldat mort et deux autres blessés dans l'explosion d'une mine terrestre""",Xinhua French News Service;Xinhua French News Service,2018-10-04;2018-10-03,"Tunisie : les conflits politiques alimentent les défaillances sécuritaires (ministre de la Défense);Tunisie : au centre-ouest, un soldat mort et deux autres blessés dans l'explosion d'une mine terrestre",le ministère tunisien de la Défense,2,Jebel Chaambi,Jebel Chambi in Kasserine Governorate,Kassérine governorate,-,35.183333,8.65,POINT (8.65 35.183333),180378,Tunisia,616,Africa,1,1,10/03/2018 00:00:00,10/03/2018 00:00:00,2,0,0,0,2,2,2,616.0,-,41
269068,TUN-2018-1-14744-4,2018,False,Clear,1,343,343,Tunisia: Government,14744,14744,Government of Tunisia - JAK-T,110,110,Government of Tunisia,6359,6359,JAK-T,2,"""AnStrat Intelligence ,2018-12-28,JaKI Operative: Mourad Ghozlani"";""Xinhua French News Service,2018-10-21,Tunisie : un terroriste abattu avant qu'il ne déclenche sa ceinture explosive à Kasserine""",AnStrat Intelligence ;Xinhua French News Service,2018-12-28;2018-10-21,JaKI Operative: Mourad Ghozlani;Tunisie : un terroriste abattu avant qu'il ne déclenche sa ceinture explosive à Kasserine,spokesman of the national guard,2,Sbiba town,near Sbiba,Kassérine governorate,Sbiba delegation,35.54332,9.0737,POINT (9.0737 35.54332),181099,Tunisia,616,Africa,1,1,10/21/2018 00:00:00,10/21/2018 00:00:00,0,1,0,0,1,1,1,616.0,-,41
274633,TUN-2018-1-10882-6,2018,False,Clear,1,343,343,Tunisia: Government,10882,10882,Government of Tunisia - AQIM,110,110,Government of Tunisia,539,539,AQIM,3,"""All Africa,2018-12-20,Terrorist Shot Dead On Mount Ouergha in Kef Governorate
CR 	Tunis Afrique Presse"";""BBC Monitoring Middle East,2018-12-27,Al-Qaeda affiliate denies jihadist killed by security forces in Tunisia"";""International Crisis Group,2019-01-01,Tunisia  DECEMBER 2018""",All Africa;BBC Monitoring Middle East;International Crisis Group,2018-12-20;2018-12-27;2019-01-01,"Terrorist Shot Dead On Mount Ouergha in Kef Governorate
CR 	Tunis Afrique Presse;Al-Qaeda affiliate denies jihadist killed by security forces in Tunisia;Tunisia  DECEMBER 2018",security source,3,Sakiet Sidi Youssef delegation,-,Le Kef governorate,Sakiet Sidi Youssef delegation,36.216667,8.35,POINT (8.35 36.216667),181817,Tunisia,616,Africa,1,1,12/19/2018 00:00:00,12/19/2018 00:00:00,0,1,0,0,1,1,1,616.0,-,41
274756,TUN-2018-1-14744-5,2018,False,Clear,1,343,343,Tunisia: Government,14744,14744,Government of Tunisia - JAK-T,110,110,Government of Tunisia,6359,6359,JAK-T,2,"""All Africa,2018-12-17,Nécessité d'actualiser les plans sécuritaires et d'accroître la vigilance
CR 	La Presse"";""International Crisis Group,2019-01-01,Tunisia  DECEMBER 2018""",All Africa;International Crisis Group,2018-12-17;2019-01-01,"Nécessité d'actualiser les plans sécuritaires et d'accroître la vigilance
CR 	La Presse;Tunisia  DECEMBER 2018",interior ministry,3,Sbiba delegation,"in the town of Thamed near Mount Mghilla

al-Thamad",Kassérine governorate,Sbiba delegation,35.507496,9.152323,POINT (9.152323 35.507496),181099,Tunisia,616,Africa,1,1,12/15/2018 00:00:00,12/15/2018 00:00:00,0,1,0,0,1,1,1,616.0,-,41
281781,TUN-2019-1-14744-1,2019,False,Clear,1,343,343,Tunisia: Government,14744,14744,Government of Tunisia - JAK-T,110,110,Government of Tunisia,6359,6359,JAK-T,3,"""Reuters News,2019-03-19,Tunisian forces kill three Islamic State militants near Algerian border"";""BBC Monitoring Middle East,2019-03-20,Tunisian security forces kill three IS-linked group members"";""AnStrat Intelligence ,2021-01-08,JaKI Operative: Houssem Thelithi""",Reuters News;BBC Monitoring Middle East;AnStrat Intelligence,2019-03-19;2019-03-20;2021-01-08,Tunisian forces kill three Islamic State militants near Algerian border;Tunisian security forces kill three IS-linked group members;JaKI Operative: Houssem Thelithi,security official,2,Jebel Selloum,in the Saloum mountains in Kasserine,Kassérine governorate,Kasserine Sud delegation,35.07485,8.90575,POINT (8.90575 35.07485),180378,Tunisia,616,Africa,1,1,03/19/2019 00:00:00,03/19/2019 00:00:00,0,3,0,0,3,3,3,616.0,-,41
284469,TUN-2019-1-10882-0,2019,False,Clear,1,343,343,Tunisia: Government,10882,10882,Government of Tunisia - AQIM,110,110,Government of Tunisia,539,539,AQIM,2,"""BBC Monitoring Middle East,2019-04-27,Al-Qaeda affiliate claims mine attack on Tunisia army"";""AnStrat Intelligence ,2019-08-09,KUIN Claims of Responsibility (2019)""",BBC Monitoring Middle East;AnStrat Intelligence,2019-04-27;2019-08-09,Al-Qaeda affiliate claims mine attack on Tunisia army;KUIN Claims of Responsibility (2019),government-run Shems FM radio; KUIN,2,Jebel Chaambi,-,Kassérine governorate,-,35.183333,8.65,POINT (8.65 35.183333),180378,Tunisia,616,Africa,1,1,04/26/2019 00:00:00,04/26/2019 00:00:00,1,0,0,0,1,1,1,616.0,-,41
287101,TUN-2019-1-14744-2,2019,False,Clear,1,343,343,Tunisia: Government,14744,14744,Government of Tunisia - JAK-T,110,110,Government of Tunisia,6359,6359,JAK-T,2,"""Agence France Presse,2019-05-05,Tunisia security forces kill three suspected jihadists"";""Reuters News,2019-05-04,UPDATE 1-Tunisia police kills three militants in Sidi Bouzid""",Agence France Presse;Reuters News,2019-05-05;2019-05-04,Tunisia security forces kill three suspected jihadists;UPDATE 1-Tunisia police kills three militants in Sidi Bouzid,security source,2,Sidi Ali Ben Aoun town,near the town of Sidi Ali Ben Oun,Sidi Bou Zid governorate,Sidi Ali Ben Aoun delegation,34.847749,9.141441,POINT (9.141441 34.847749),179659,Tunisia,616,Africa,1,1,05/04/2019 00:00:00,05/04/2019 00:00:00,0,3,0,0,3,3,3,616.0,-,41
290582,TUN-2019-1-14747-3,2019,False,Clear,1,14333,14333,Tunisia: Islamic State,14747,14747,Government of Tunisia - IS,110,110,Government of Tunisia,234,234,IS,6,"""Associated Press Newswires,2019-06-27,The Latest: Police officer dies in Tunisia suicide attack"";""Agence France Presse,2019-06-27,Double suicide blasts wound nine in Tunisia capital"";""Reuters News,2019-06-27,Islamic State claims suicide attacks on police in Tunisian capital"";""Agence France Presse,2019-07-04,Tunis bombings death toll rises to two"";""AnStrat Intelligence ,2019-09-23,Jihadi Operative: Mohammed al-Kahlaoui"";""AnStrat Intelligence ,2019-09-24,Entity: Samiri and Kahlaoui Module [SKM]""",Associated Press Newswires;Agence France Presse;Reuters News;Agence France Presse;AnStrat Intelligence ;AnStrat Intelligence,2019-06-27;2019-06-27;2019-06-27;2019-07-04;2019-09-23;2019-09-24,The Latest: Police officer dies in Tunisia suicide attack;Double suicide blasts wound nine in Tunisia capital;Islamic State claims suicide attacks on police in Tunisian capital;Tunis bombings death toll rises to two;Jihadi Operative: Mohammed al-Kahlaoui;Entity: Samiri and Kahlaoui Module [SKM],the interior ministry,1,Tunis city,"in the Tunisian capital , 
1) Habib Bourguiba avenue near the old city,
2) a base of the national guard",Tunis governorate,La Médina delegation,36.806112,10.171078,POINT (10.171078 36.806112),182541,Tunisia,616,Africa,1,1,06/27/2019 00:00:00,06/27/2019 00:00:00,1,2,1,0,4,4,4,616.0,-,41
290587,TUN-2019-1-14747-4,2019,False,Clear,1,14333,14333,Tunisia: Islamic State,14747,14747,Government of Tunisia - IS,110,110,Government of Tunisia,234,234,IS,3,"""Reuters News,2019-07-02,TUNISIA SECURITY FORCES KILLED A 'TERRORIST' WEARING AN EXPLOSIVE BELT; NO CASUALTIES -INTERIOR MINISTRY SPOKESMAN"";""Associated Press Newswires,2019-07-03,Tunisia: Blast kills suspect in confrontation with police"";""Agence France Presse,2019-07-03,Tunisia says suspected mastermind of June 27 bombings dead""",Reuters News;Associated Press Newswires;Agence France Presse,2019-07-02;2019-07-03;2019-07-03,TUNISIA SECURITY FORCES KILLED A 'TERRORIST' WEARING AN EXPLOSIVE BELT; NO CASUALTIES -INTERIOR MINISTRY SPOKESMAN;Tunisia: Blast kills suspect in confrontation with police;Tunisia says suspected mastermind of June 27 bombings dead,INTERIOR MINISTRY SPOKESMAN,1,Tunis city,in the suburban Tunis neighborhood of Intilaki,Tunis governorate,La Médina delegation,36.806112,10.171078,POINT (10.171078 36.806112),182541,Tunisia,616,Africa,1,1,07/02/2019 00:00:00,07/02/2019 00:00:00,0,1,0,0,1,1,1,616.0,-,41
293035,TUN-2019-1-14744-0,2019,False,Clear,1,343,343,Tunisia: Government,14744,14744,Government of Tunisia - JAK-T,110,110,Government of Tunisia,6359,6359,JAK-T,2,"""Agence France Presse,2019-08-03,Tunisia says kills two jihadists in military operation"";""@MENASTREAM,2019-08-03,#Tunisia""",Agence France Presse;@MENASTREAM,2019-08-03;2019-08-03,Tunisia says kills two jihadists in military operation;#Tunisia,the interior ministry,2,Jebel Orbata,in the mountainous area of Orbata in Gafsa,Gafsa governorate,El Guetar delegation,34.39641,9.12914,POINT (9.12914 34.39641),178939,Tunisia,616,Africa,1,1,08/03/2019 00:00:00,08/03/2019 00:00:00,0,2,0,0,2,2,2,616.0,-,41
