id,relid,year,active_year,code_status,type_of_violence,conflict_dset_id,conflict_new_id,conflict_name,dyad_dset_id,dyad_new_id,dyad_name,side_a_dset_id,side_a_new_id,side_a,side_b_dset_id,side_b_new_id,side_b,number_of_sources,source_article,source_office,source_date,source_headline,source_original,where_prec,where_coordinates,where_description,adm_1,adm_2,latitude,longitude,geom_wkt,priogrid_gid,country,country_id,region,event_clarity,date_prec,date_start,date_end,deaths_a,deaths_b,deaths_civilians,deaths_unknown,best,high,low,gwnoa,gwnob,interaction
286788,AFG-2019-3-973-71,2019,True,Clear,3,234,506,IS - Civilians,234,973,IS - Civilians,234,234,IS,9999,1,Civilians,2,"""Nord Sud Journal,2019-05-17,Mali-Burkina Faso: return on the operation that freed hostages kidnapped in Benin"";""Reuters News,2019-05-05,Benin guide for missing French tourists found dead""",Nord Sud Journal;Reuters News,2019-05-17;2019-05-05,Mali-Burkina Faso: return on the operation that freed hostages kidnapped in Benin;Benin guide for missing French tourists found dead,-,5,Pendjari National Park,"Pendjari National Park,",Atacora department,-,11.04999,1.51667,POINT (1.51667 11.04999),145804,Benin,434,Africa,1,1,05/03/2019 00:00:00,05/03/2019 00:00:00,0,0,1,0,1,1,1,-,-,15
393843,BEN-2020-1-16685-0,2020,False,Clear,1,15256,15256,Benin: Government,16685,16685,Government of Benin - JNIM,1209,1209,Government of Benin,6716,6716,JNIM,2,"""Africa News,2020-02-10,Deadly attack on Benin police post along border with Burkina Faso"";""Garda World,2021-07-08,Benin Country Report""",Africa News;Garda World,2020-02-10;2021-07-08,Deadly attack on Benin police post along border with Burkina Faso;Benin Country Report,-,2,W National Park (Benin),"village of Mekrou-Djimdjim

near one of the wildlife areas known as W National Park straddling the borders of northern Benin, Burkina Faso and Niger",Alibori department,Karimama commune,12.038249,3.03389,POINT (3.03389 12.038249),147247,Benin,434,Africa,1,1,02/09/2020 00:00:00,02/09/2020 00:00:00,1,0,0,0,1,1,1,434.0,-,41
392951,BEN-2021-1-16685-1,2021,False,Clear,1,15256,15256,Benin: Government,16685,16685,Government of Benin - JNIM,1209,1209,Government of Benin,6716,6716,JNIM,2,"""Menastream on Twitter,2021-03-30,#Benin"";""Menastream on Twitter,2021-03-30,#Benin""",Menastream on Twitter;Menastream on Twitter,2021-03-30;2021-03-30,#Benin;#Benin,-,1,Tanguieta town,"in the area of the Pendjari National Park (Tanguieta), #Atacora.",Atacora department,Matéri commune,10.622452,1.264817,POINT (1.264817 10.622452),145083,Benin,434,Africa,1,1,03/25/2021 00:00:00,03/25/2021 00:00:00,0,3,0,0,3,3,3,434.0,-,41
423524,BEN-2021-1-16685-3,2021,False,Clear,1,15256,15256,Benin: Government,16685,16685,Government of Benin - JNIM,1209,1209,Government of Benin,6716,6716,JNIM,5,"""Reuters News,2021-12-02,UPDATE 1-Two soldiers killed in Islamist militant attack in northern Benin, army says"";""Agence France Presse,2021-12-02,Two Benin soldiers killed in jihadist attack in north: military sources"";""La Nouvelle Tribune,2021-12-02,Attaque djihadiste à Porga au Bénin: décès de 2 militaires et d’un terroriste"";""24 heures au Benin,2021-12-01,Un homme armé tué ce mercredi à Banikoara"";""Clingendael,2021-12-31,Under the microscope: Inside the attacks on Porga and Keremou """,Reuters News;Agence France Presse;La Nouvelle Tribune;24 heures au Benin;Clingendael,2021-12-02;2021-12-02;2021-12-02;2021-12-01;2021-12-31,"UPDATE 1-Two soldiers killed in Islamist militant attack in northern Benin, army says;Two Benin soldiers killed in jihadist attack in north: military sources;Attaque djihadiste à Porga au Bénin: décès de 2 militaires et d’un terroriste;Un homme armé tué ce mercredi à Banikoara;Under the microscope: Inside the attacks on Porga and Keremou","Benin Army, Chief of General Staff from the Military",1,Keremou town,"Mékrou bridge in Banikoara commune, Alibori department in northern Benin.",Alibori department,Banikoara commune,11.34724,2.32196,POINT (2.32196 11.34724),145805,Benin,434,Africa,1,1,11/30/2021 00:00:00,11/30/2021 00:00:00,0,1,0,0,1,1,1,434.0,-,41
423525,BEN-2021-1-16685-4,2021,False,Clear,1,15256,15256,Benin: Government,16685,16685,Government of Benin - JNIM,1209,1209,Government of Benin,6716,6716,JNIM,4,"""Agence France Presse,2021-12-02,Two Benin soldiers killed in jihadist attack in north: military sources"";""Reuters News,2021-12-02,UPDATE 1-Two soldiers killed in Islamist militant attack in northern Benin, army says"";""La Nouvelle Tribune,2021-12-02,Attaque djihadiste à Porga au Bénin: décès de 2 militaires et d’un terroriste"";""Clingendael,2021-12-31,Under the microscope: Inside the attacks on Porga and Keremou""",Agence France Presse;Reuters News;La Nouvelle Tribune;Clingendael,2021-12-02;2021-12-02;2021-12-02;2021-12-31,"Two Benin soldiers killed in jihadist attack in north: military sources;UPDATE 1-Two soldiers killed in Islamist militant attack in northern Benin, army says;Attaque djihadiste à Porga au Bénin: décès de 2 militaires et d’un terroriste;Under the microscope: Inside the attacks on Porga and Keremou","Military officials, Benin Armed Forces General Staff",1,Porga town,Porga in the commune of Materi (Atakora department),Atacora department,Matéri commune,11.05,0.966667,POINT (0.966667 11.05),145802,Benin,434,Africa,1,2,12/01/2021 00:00:00,12/02/2021 00:00:00,2,1,0,0,3,3,3,434.0,-,41
425902,BEN-2021-1-16685-5,2021,False,Clear,1,15256,15256,Benin: Government,16685,16685,Government of Benin - JNIM,1209,1209,Government of Benin,6716,6716,JNIM,1,"""Clingendael,2021-12-31,Under the microscope: Inside the attacks on Porga and Keremou """,Clingendael,2021-12-31,Under the microscope: Inside the attacks on Porga and Keremou,Clingendael,2,Sonsoro village,"in the village of Bekoutarou, near Sonsoro",Alibori department,Kandi commune,11.08642,2.759318,POINT (2.759318 11.08642),145806,Benin,434,Africa,1,1,12/08/2021 00:00:00,12/08/2021 00:00:00,0,0,1,0,1,1,1,434.0,-,41
426058,BEN-2021-1-16685-6,2021,False,Clear,1,15256,15256,Benin: Government,16685,16685,Government of Benin - JNIM,1209,1209,Government of Benin,6716,6716,JNIM,1,"""Clingendael,2021-12-31,Under the microscope: Inside the attacks on Porga and Keremou """,Clingendael,2021-12-31,Under the microscope: Inside the attacks on Porga and Keremou,-,1,Tayakou village,in the village of Tayakou.,Atacora department,Tanguiéta,10.552128,1.199101,POINT (1.199101 10.552128),145083,Benin,434,Africa,1,1,12/04/2021 00:00:00,12/04/2021 00:00:00,1,0,0,0,1,1,1,434.0,-,41
428225,BEN-2022-1-16685-0,2022,True,Clear,1,15256,15256,Benin: Government,16685,16685,Government of Benin - JNIM,1209,1209,Government of Benin,6716,6716,JNIM,3,"""Reuters News,2022-01-06,Benin army vehicle strikes land mine as security fears in north grow"";""Agence France Presse,2022-01-07,Two Benin soldiers killed after running over bomb"";""BBC Monitoring Africa,2022-01-07,Two Benin soldiers killed in roadside blast""",Reuters News;Agence France Presse;BBC Monitoring Africa,2022-01-06;2022-01-07;2022-01-07,Benin army vehicle strikes land mine as security fears in north grow;Two Benin soldiers killed after running over bomb;Two Benin soldiers killed in roadside blast,military,5,Pendjari National Park,Pendjari National Park,Atacora department,-,11.04999,1.51667,POINT (1.51667 11.04999),145804,Benin,434,Africa,1,1,01/06/2022 00:00:00,01/06/2022 00:00:00,2,0,0,0,2,2,2,434.0,-,41
431254,BEN-2022-1-16685-1,2022,True,Clear,1,15256,15256,Benin: Government,16685,16685,Government of Benin - JNIM,1209,1209,Government of Benin,6716,6716,JNIM,9,"""International Crisis Group,2022-03-05,Crisis Watch: Benin FEBRUARY 2022"";""Reuters News,2022-02-10,French national among six killed in Benin attack, sources say"";""Reuters News,2022-02-09,Five rangers, soldier killed in attack in Benin, park management says"";""Reuters News,2022-02-11,France launches terrorism probe over attack in northern Benin"";""Agence France Presse,2022-02-11,Benin attacks toll rises to nine, including Frenchman"";""Aljazeera,2022-02-13,French air raids kill 40 fighters in Burkina Faso"";""France 24,2022-02-11,Trois attaques ont fait au moins 9 morts dont un Français dans le nord du Bénin"";""France 24,2022-02-10,Le parquet antiterroriste ouvre une enquête après la mort d'un Français dans une attaque au Bénin"";""Franceinfo,2022-02-11,Le point sur African Parks, touché par des attaques terroristes au parc naturel W au Bénin""",International Crisis Group;Reuters News;Reuters News;Reuters News;Agence France Presse;Aljazeera;France 24;France 24;Franceinfo,2022-03-05;2022-02-10;2022-02-09;2022-02-11;2022-02-11;2022-02-13;2022-02-11;2022-02-10;2022-02-11,"Crisis Watch: Benin FEBRUARY 2022;French national among six killed in Benin attack, sources say;Five rangers, soldier killed in attack in Benin, park management says;France launches terrorism probe over attack in northern Benin;Benin attacks toll rises to nine, including Frenchman;French air raids kill 40 fighters in Burkina Faso;Trois attaques ont fait au moins 9 morts dont un Français dans le nord du Bénin;Le parquet antiterroriste ouvre une enquête après la mort d'un Français dans une attaque au Bénin;Le point sur African Parks, touché par des attaques terroristes au parc naturel W au Bénin","African Parks, the South African non-profit group that manages the W National Park and the Pendjari National Park",2,W National Park (Benin),W National Park near border with Niger and Burkina Faso,Alibori department,Karimama commune,12.038249,3.03389,POINT (3.03389 12.038249),147247,Benin,434,Africa,1,1,02/08/2022 00:00:00,02/08/2022 00:00:00,6,0,1,1,8,8,8,434.0,-,41
431259,BEN-2022-1-16685-2,2022,True,Clear,1,15256,15256,Benin: Government,16685,16685,Government of Benin - JNIM,1209,1209,Government of Benin,6716,6716,JNIM,4,"""Aljazeera,2022-02-13,French air raids kill 40 fighters in Burkina Faso"";""International Crisis Group,2022-03-05,Crisis Watch: Benin FEBRUARY 2022"";""Agence France Presse,2022-02-11,Benin attacks toll rises to nine, including Frenchman"";""Reuters News,2022-02-11,France launches terrorism probe over attack in northern Benin""",Aljazeera;International Crisis Group;Agence France Presse;Reuters News,2022-02-13;2022-03-05;2022-02-11;2022-02-11,"French air raids kill 40 fighters in Burkina Faso;Crisis Watch: Benin FEBRUARY 2022;Benin attacks toll rises to nine, including Frenchman;France launches terrorism probe over attack in northern Benin",Benin authorities,2,W National Park (Benin),W National Park near border with Niger and Burkina Faso,Alibori department,Karimama commune,12.038249,3.03389,POINT (3.03389 12.038249),147247,Benin,434,Africa,1,1,02/10/2022 00:00:00,02/10/2022 00:00:00,1,0,0,0,1,1,1,434.0,-,41
436975,BEN-2022-1-16685-4,2022,True,Clear,1,15256,15256,Benin: Government,16685,16685,Government of Benin - JNIM,1209,1209,Government of Benin,6716,6716,JNIM,2,"""Daabaaru,2022-04-12,ATTAQUE TERRORISTE AU PARC PENDJARI : Cinq morts et des blessés graves"";""Africa Research Bulletin,2022-05-05,Benin: Rising Insecurity""",Daabaaru;Africa Research Bulletin,2022-04-12;2022-05-05,ATTAQUE TERRORISTE AU PARC PENDJARI : Cinq morts et des blessés graves;Benin: Rising Insecurity,senior security source and a parks conservation group involved in the area,5,Pendjari National Park,PENDJARI PARK,Atacora department,-,11.04999,1.51667,POINT (1.51667 11.04999),145804,Benin,434,Africa,1,1,04/11/2022 00:00:00,04/11/2022 00:00:00,5,0,0,0,5,5,5,434.0,-,41
442360,BEN-2022-1-16685-5,2022,True,Clear,1,15256,15256,Benin: Government,16685,16685,Government of Benin - JNIM,1209,1209,Government of Benin,6716,6716,JNIM,4,"""Agence France Presse,2022-06-26,Two police officers killed in northern Benin attack"";""Reuters News,2022-06-26,Two police officers killed in north Benin attack"";""RFI,2022-06-26,Bénin: le commissariat de Dassari, dans le nord du pays, attaqué par un groupe armé"";""Agence Anadolu,2022-06-26,Bénin : Une nouvelle attaque fait 2 morts parmi les forces de sécurité""",Agence France Presse;Reuters News;RFI;Agence Anadolu,2022-06-26;2022-06-26;2022-06-26;2022-06-26,"Two police officers killed in northern Benin attack;Two police officers killed in north Benin attack;Bénin: le commissariat de Dassari, dans le nord du pays, attaqué par un groupe armé;Bénin : Une nouvelle attaque fait 2 morts parmi les forces de sécurité","local official in Dassari, Crisis Watch",1,Dassari village,Dassari police station,Atacora department,Matéri commune,10.807688,1.141906,POINT (1.141906 10.807688),145083,Benin,434,Africa,1,1,06/26/2022 00:00:00,06/26/2022 00:00:00,2,2,0,0,4,4,4,434.0,-,41
444555,BEN-2022-1-16685-6,2022,True,Clear,1,15256,15256,Benin: Government,16685,16685,Government of Benin - JNIM,1209,1209,Government of Benin,6716,6716,JNIM,3,"""Menastream,2022-05-02,Menastream #Benin"";""Agence France Presse,2022-04-27,Gunmen Kill One In Attack On North Benin Police Post: Media"";""Africa Research Bulletin,2022-05-05,Benin: Rising Insecurity""",Menastream;Agence France Presse;Africa Research Bulletin,2022-05-02;2022-04-27;2022-05-05,Menastream #Benin;Gunmen Kill One In Attack On North Benin Police Post: Media;Benin: Rising Insecurity,State-run newspaper,1,Monsey town,"commune of Karimama, near the border with Niger

police station in Monsey, a district of the town of Karimama, in northeastern Benin, on the border with Niger",Alibori department,Karimama commune,12.292279,2.923995,POINT (2.923995 12.292279),147246,Benin,434,Africa,1,1,04/26/2022 00:00:00,04/26/2022 00:00:00,1,0,0,0,1,1,1,434.0,-,41
452812,BEN-2022-1-16685-12,2022,True,Clear,1,15256,15256,Benin: Government,16685,16685,Government of Benin - JNIM,1209,1209,Government of Benin,6716,6716,JNIM,6,"""Sahel Media,2022-10-12,#Bénin. #Terrorisme"";""Jihadist Attacks in Littoral West Africa,2022-10-12,Jihadist Attacks in Littoral West Africa-2016 to Present"";""Agence France Presse,2022-10-13,Benin foils 'terrorist' attack, kills 8 gunmen: army"";""L.frii,2022-10-12,Bénin : une nouvelle attaque terroriste repoussée par l’armée ; 8 morts enregistrés dans le camp des assaillants"";""Terrorism Monitor ,2022-10-21,Islamic State in Greater Sahara Revives Operations from Northern Mali to Benin"";""VOA,2022-10-13,Benin Foils 'Terrorist' Attack, Kills 8 Gunmen, Army Says""",Sahel Media;Jihadist Attacks in Littoral West Africa;Agence France Presse;L.frii;Terrorism Monitor ;VOA,2022-10-12;2022-10-12;2022-10-13;2022-10-12;2022-10-21;2022-10-13,"#Bénin. #Terrorisme;Jihadist Attacks in Littoral West Africa-2016 to Present;Benin foils 'terrorist' attack, kills 8 gunmen: army;Bénin : une nouvelle attaque terroriste repoussée par l’armée ; 8 morts enregistrés dans le camp des assaillants;Islamic State in Greater Sahara Revives Operations from Northern Mali to Benin;Benin Foils 'Terrorist' Attack, Kills 8 Gunmen, Army Says",-,1,Nouadi town,"Nouari, Materi, Atakora",Atacora department,Matéri commune,10.914,1.069,POINT (1.069 10.914),145083,Benin,434,Africa,1,2,10/11/2022 00:00:00,10/12/2022 00:00:00,0,8,0,0,8,8,8,434.0,-,41
457510,BEN-2022-1-16685-15,2022,True,Clear,1,15256,15256,Benin: Government,16685,16685,Government of Benin - JNIM,1209,1209,Government of Benin,6716,6716,JNIM,3,"""Africa Research Bulletin,2022-12-05,IN BRIEF: Benin"";""Banouto,2022-11-25,Benin: Attacks in Kalale and Kerou, the army pushes back and kills attackers"";""Agence Anadolu,2022-11-25,Bénin: l’armée neutralise quatre terroristes dans le nord du pays (officiel)""",Africa Research Bulletin;Banouto;Agence Anadolu,2022-12-05;2022-11-25;2022-11-25,"IN BRIEF: Benin;Benin: Attacks in Kalale and Kerou, the army pushes back and kills attackers;Bénin: l’armée neutralise quatre terroristes dans le nord du pays (officiel)",-,1,Kaobagou town,"Kaoubagou, Kerou",Atacora department,Kérou commune,11.068111,1.920931,POINT (1.920931 11.068111),145804,Benin,434,Africa,1,1,11/25/2022 00:00:00,11/25/2022 00:00:00,0,1,0,0,1,4,1,434.0,-,41
464489,BEN-2021-1-16685-8,2021,False,Clear,1,15256,15256,Benin: Government,16685,16685,Government of Benin - JNIM,1209,1209,Government of Benin,6716,6716,JNIM,1,"""RFI,2021-12-23,Bénin: nouvelle attaque dans le nord-ouest du pays""",RFI,2021-12-23,Bénin: nouvelle attaque dans le nord-ouest du pays,-,3,Matéri commune,"Arly post

-> It is a position of the Beninese armed forces on the border of Burkina Faso. The nearest town in the area is Tanguiéta, 600 km north of Cotonou.",Atacora department,Matéri commune,10.7986,1.02756,POINT (1.02756 10.7986),145083,Benin,434,Africa,1,1,12/22/2021 00:00:00,12/22/2021 00:00:00,1,1,0,0,2,3,2,434.0,-,41
468286,BEN-2023-1-16685-0,2023,True,Clear,1,15256,15256,Benin: Government,16685,16685,Government of Benin - JNIM,1209,1209,Government of Benin,6716,6716,JNIM,1,"""Actu Cameroun,2023-01-02,Bénin – Attaque terroriste: deux civils tués par un EEI dans le nord du pays""",Actu Cameroun,2023-01-02,Bénin – Attaque terroriste: deux civils tués par un EEI dans le nord du pays,-,1,Karimama town,"Kofounou-Mamassy Gourma road, in the town of Karimama",Alibori department,Karimama commune,12.06911,3.18405,POINT (3.18405 12.06911),147247,Benin,434,Africa,1,1,01/01/2023 00:00:00,01/01/2023 00:00:00,0,0,2,0,2,2,2,434.0,-,41
471136,BEN-2023-1-16685-1,2023,True,Clear,1,15256,15256,Benin: Government,16685,16685,Government of Benin - JNIM,1209,1209,Government of Benin,6716,6716,JNIM,3,"""24 heures au Benin,2023-02-22,L’armée béninoise à l’assaut des individus armés à Matéri"";""International Crisis Group,2023-03-05,Crisis Watch: Benin February 2023"";""Wamaps,2023-02-22,Tweet""",24 heures au Benin;International Crisis Group;Wamaps,2023-02-22;2023-03-05;2023-02-22,L’armée béninoise à l’assaut des individus armés à Matéri;Crisis Watch: Benin February 2023;Tweet,-,1,Daloga village,"locality of Daloga, not far from the commune of Materi in Benin's northwestern Atakora Department",Atacora department,-,10.743398,0.982153,POINT (0.982153 10.743398),145082,Benin,434,Africa,1,1,02/21/2023 00:00:00,02/21/2023 00:00:00,1,2,0,0,3,3,3,434.0,-,41
471151,BEN-2023-1-16685-3,2023,True,Clear,1,15256,15256,Benin: Government,16685,16685,Government of Benin - JNIM,1209,1209,Government of Benin,6716,6716,JNIM,2,"""Les Pharaons,2023-03-16,Bénin.Les autorités sécuritaires muettes après une attaque signalée à Karimama - Les Pharaons"";""Wamaps,2023-03-16,Tweet""",Les Pharaons;Wamaps,2023-03-16;2023-03-16,Bénin.Les autorités sécuritaires muettes après une attaque signalée à Karimama - Les Pharaons;Tweet,-,2,Mamassi village,Mamassy-Peulh village,Alibori department,Karimama commune,12.045672,3.132625,POINT (3.132625 12.045672),147247,Benin,434,Africa,1,2,03/14/2023 00:00:00,03/15/2023 00:00:00,0,0,1,0,1,1,1,434.0,-,41
471165,BEN-2023-1-16685-4,2023,True,Clear,1,15256,15256,Benin: Government,16685,16685,Government of Benin - JNIM,1209,1209,Government of Benin,6716,6716,JNIM,1,"""Benin Web TV,2023-03-06,Bénin: une nouvelle attaque terroriste fait un mort à Matéri""",Benin Web TV,2023-03-06,Bénin: une nouvelle attaque terroriste fait un mort à Matéri,-,1,Nouadi town,Nouari,Atacora department,Matéri commune,10.914,1.069,POINT (1.069 10.914),145083,Benin,434,Africa,1,2,03/05/2023 00:00:00,03/06/2023 00:00:00,0,0,1,0,1,1,1,434.0,-,41
473958,BEN-2023-3-15136-57,2023,True,Clear,3,6716,13968,JNIM - Civilians,6716,15136,JNIM - Civilians,6716,6716,JNIM,9999,1,Civilians,4,"""Agence France Presse,2023-05-04,Benin orders probe after violence kills 15 in north"";""Le Monde,2023-05-04,Northern Benin hit by two new deadly attacks in two days Twenty people were killed in Kaobagou and Guimbagou. There has been no claim of responsibility for these acts, but all eyes are on the jihadists who want to expand their territory towards the Gulf of Guinea."";""Fraternite FM,2023-05-02,Des morts et des disparus dans une attaque djihadiste !"";""RFI,2023-05-03,Bénin: une dizaine de civils tués par des assaillants dans le Nord-Ouest""",Agence France Presse;Le Monde;Fraternite FM;RFI,2023-05-04;2023-05-04;2023-05-02;2023-05-03,"Benin orders probe after violence kills 15 in north;Northern Benin hit by two new deadly attacks in two days Twenty people were killed in Kaobagou and Guimbagou. There has been no claim of responsibility for these acts, but all eyes are on the jihadists who want to expand their territory towards the Gulf of Guinea.;Des morts et des disparus dans une attaque djihadiste !;Bénin: une dizaine de civils tués par des assaillants dans le Nord-Ouest",Residents,1,Kaobagou town,"Kouabagou, one of the four districts of the commune of Kérou",Atacora department,Kérou commune,11.068111,1.920931,POINT (1.920931 11.068111),145804,Benin,434,Africa,1,2,05/01/2023 00:00:00,05/02/2023 00:00:00,0,0,7,0,7,15,7,-,-,15
473959,BEN-2023-3-15136-59,2023,True,Clear,3,6716,13968,JNIM - Civilians,6716,15136,JNIM - Civilians,6716,6716,JNIM,9999,1,Civilians,2,"""Beninweb.tv,2023-05-03,Bénin: 03 morts dans une nouvelle attaque terroriste à Banikoara"";""Agence France Presse,2023-05-04,Benin orders probe after violence kills 15 in north""",Beninweb.tv;Agence France Presse,2023-05-03;2023-05-04,Bénin: 03 morts dans une nouvelle attaque terroriste à Banikoara;Benin orders probe after violence kills 15 in north,Benin police source,1,Yinyinrou village,"Banikoara area, Yinyinrou",Alibori department,Banikoara commune,11.30844,2.144809,POINT (2.1448097 11.30844),145805,Benin,434,Africa,1,2,05/02/2023 00:00:00,05/03/2023 00:00:00,0,0,3,0,3,3,3,-,-,15
475468,BEN-2023-1-16685-22,2023,True,Clear,1,15256,15256,Benin: Government,16685,16685,Government of Benin - JNIM,1209,1209,Government of Benin,6716,6716,JNIM,4,"""International Crisis Group,2023-05-01,Benin APRIL 2023"";""Kris in Onuaga,2023-04-05,Tweet 1"";""Kris in Onuaga,2023-04-05,Tweet 2"";""Africa Research Bulletin,2023-05-01,National Security: Benin""",International Crisis Group;Kris in Onuaga;Kris in Onuaga;Africa Research Bulletin,2023-05-01;2023-04-05;2023-04-05;2023-05-01,Benin APRIL 2023;Tweet 1;Tweet 2;National Security: Benin,Crisis Watch,1,Daga village,"Daga, near Porga commune",Atacora department,Matéri commune,10.9844,1.005811,POINT (1.0058117 10.9844),145083,Benin,434,Africa,1,2,04/03/2023 00:00:00,04/04/2023 00:00:00,0,0,0,0,0,3,0,434.0,-,41
478475,BEN-2023-1-16685-6,2023,True,Clear,1,15256,15256,Benin: Government,16685,16685,Government of Benin - JNIM,1209,1209,Government of Benin,6716,6716,JNIM,1,"""International Crisis Group,2023-06-05,Crisis Watch: Benin May 2023""",International Crisis Group,2023-06-05,Crisis Watch: Benin May 2023,-,3,Matéri commune,"Matéri commune, Atakora department",Atacora department,Matéri commune,10.7986,1.02756,POINT (1.02756 10.7986),145083,Benin,434,Africa,1,1,05/12/2023 00:00:00,05/12/2023 00:00:00,0,1,0,0,1,1,1,434.0,-,41
480390,BEN-2023-1-16685-24,2023,True,Clear,1,15256,15256,Benin: Government,16685,16685,Government of Benin - JNIM,1209,1209,Government of Benin,6716,6716,JNIM,2,"""Fraternite FM,2023-05-10,Deux morts et une blessée cette nuit"";""Wamaps,2023-05-10,Tweet""",Fraternite FM;Wamaps,2023-05-10;2023-05-10,Deux morts et une blessée cette nuit;Tweet,-,2,Nambouli village,"Matéri in the district of Tantega, not far from the village of Nambouli",Atacora department,-,10.811077,1.005061,POINT (1.0050614 10.811077),145083,Benin,434,Africa,1,2,05/09/2023 00:00:00,05/10/2023 00:00:00,0,0,2,0,2,2,2,434.0,-,41
480393,BEN-2023-1-16685-23,2023,True,Clear,1,15256,15256,Benin: Government,16685,16685,Government of Benin - JNIM,1209,1209,Government of Benin,6716,6716,JNIM,2,"""Fraternite FM,2023-05-10,Encore des morts à Kaobagou !"";""Wamaps,2023-05-10,Tweet""",Fraternite FM;Wamaps,2023-05-10;2023-05-10,Encore des morts à Kaobagou !;Tweet,-,1,Kaobagou town,Kouabagou district of the commune of Kérou,Atacora department,Kérou commune,11.068111,1.920931,POINT (1.920931 11.068111),145804,Benin,434,Africa,1,1,05/10/2023 00:00:00,05/10/2023 00:00:00,0,0,3,0,3,3,3,434.0,-,41
481674,BEN-2023-1-16685-8,2023,True,Clear,1,15256,15256,Benin: Government,16685,16685,Government of Benin - JNIM,1209,1209,Government of Benin,6716,6716,JNIM,2,"""Africa Research Bulletin,2023-07-05,IN BRIEF: Benin"";""Afrik.com,2023-05-11,Bénin, Tuerie à Kérou : un autre responsable de l’armée limogé et des terroristes mis hors d’état de nuire""",Africa Research Bulletin;Afrik.com,2023-07-05;2023-05-11,"IN BRIEF: Benin;Bénin, Tuerie à Kérou : un autre responsable de l’armée limogé et des terroristes mis hors d’état de nuire",-,2,Kaobagou town,"Kerou commune
Kaobagou area",Atacora department,Kérou commune,11.068111,1.920931,POINT (1.920931 11.068111),145804,Benin,434,Africa,2,2,05/03/2023 00:00:00,05/06/2023 00:00:00,0,4,0,0,4,4,4,434.0,-,41
482946,BEN-2023-3-15136-77,2023,True,Clear,3,6716,13968,JNIM - Civilians,6716,15136,JNIM - Civilians,6716,6716,JNIM,9999,1,Civilians,1,"""Wamaps,2023-07-25,Tweet""",Wamaps,2023-07-25,Tweet,-,2,Daloga village,"hamlet of #Bouliérou (village of #Daloga , #Matéri , #Atacora )",Atacora department,-,10.743398,0.982153,POINT (0.982153 10.743398),145082,Benin,434,Africa,1,1,07/19/2023 00:00:00,07/19/2023 00:00:00,0,0,2,0,2,2,2,-,-,15
490450,BEN-2023-1-16685-11,2023,True,Clear,1,15256,15256,Benin: Government,16685,16685,Government of Benin - JNIM,1209,1209,Government of Benin,6716,6716,JNIM,1,"""Fraternite FM 96.5,2023-08-25,Quatre Individus Armés Non Identifiés neutralisés""",Fraternite FM 96.5,2023-08-25,Quatre Individus Armés Non Identifiés neutralisés,-,1,Bogobogo town,district of Bogobogo in the Commune of Karimama,Alibori department,Karimama commune,12.103854,3.105676,POINT (3.105676 12.103854),147247,Benin,434,Africa,1,1,08/25/2023 00:00:00,08/25/2023 00:00:00,0,4,0,0,4,4,4,434.0,-,41
